{
  "$schema": "https://json-schema.org/draft/2020-12/schema",
  "$id": "https://vistas.lanot.unam.mx/historic_query_schema.json",
  "title": "Esquema para consulta historica LANOT",
  "description": "Contrato de la consulta histórica. Fuente de verdad: este archivo. historic_query mantiene una copia en historic/schema/ y no debe editarla.",
  "type": "object",
  "properties": {
    "sat": {
      "type": "string",
      "description": "Nombre del satélite (ej. GOES-16, GOES-18)"
    },
    "sensor": {
      "type": "string",
      "description": "Sensor a consultar (ej. abi). Los satélites polares se distinguen por sensor y no llevan dominio."
    },
    "nivel": {
      "type": "string",
      "description": "Nivel de procesamiento. Sin enum a propósito: 'L1b'/'L2' es vocabulario GOES y no necesariamente aplica a satélites polares."
    },
    "dominio": {
      "type": "string",
      "enum": [
        "fd",
        "conus"
      ],
      "description": "Dominio geográfico. Ausente en satélites polares."
    },
    "productos": {
      "description": "Productos derivados. Use [\"ALL\"] para todos. No se enumeran: el vocabulario de productos difiere hoy entre el formulario y GOES_PERIODICITY.",
      "type": "array",
      "minItems": 1,
      "items": {
        "type": "string",
        "pattern": "^[A-Z][A-Z0-9]{1,9}$"
      }
    },
    "bandas": {
      "description": "Bandas espectrales. Use [\"ALL\"] para todas; la cadena \"ALL\" sin arreglo no es válida.",
      "type": "array",
      "minItems": 1,
      "items": {
        "type": "string",
        "enum": [
          "ALL",
          "01",
          "02",
          "03",
          "04",
          "05",
          "06",
          "07",
          "08",
          "09",
          "10",
          "11",
          "12",
          "13",
          "14",
          "15",
          "16"
        ]
      }
    },
    "fechas": {
      "type": "object",
      "description": "Fechas con conjuntos de horarios",
      "patternProperties": {
        "^\\d{4}(0[1-9]|1[0-2])(0[1-9]|[12]\\d|3[01])(-\\d{4}(0[1-9]|1[0-2])(0[1-9]|[12]\\d|3[01]))?$": {
          "type": "array",
          "items": {
            "type": "string",
            "pattern": "^([01]\\d|2[0-3]):([0-5]\\d)(-([01]\\d|2[0-3]):([0-5]\\d))?$"
          },
          "minItems": 1
        }
      },
      "additionalProperties": false,
      "minProperties": 1
    },
    "version": {
      "type": "string",
      "description": "Versión del formato de datos",
      "pattern": "^\\d+\\.\\d+\\.\\d+$"
    },
    "creado_por": {
      "type": "string",
      "description": "Usuario o sistema que creó la solicitud",
      "maxLength": 100
    },
    "timestamp": {
      "type": "string",
      "format": "date-time",
      "description": "Fecha y hora de creación en formato ISO 8601"
    }
  },
  "required": [
    "nivel",
    "fechas"
  ],
  "anyOf": [
    {
      "required": [
        "bandas"
      ]
    },
    {
      "required": [
        "productos"
      ]
    }
  ],
  "additionalProperties": false
}
